name,n_beds,distance_text,distance_value,duration_in_traffic_text,duration_in_traffic_value,duration_text,duration_value,full_direction,gps,internal_url,external_url,mobile,phone,price,description
Ferme du Canal,28,147 km,147407,1 hour 56 mins,6983,1 hour 49 mins,6542,"9 Rue des Martyrs de la Liberati, 10170 Méry-sur-Seine, France","48.511228,3.890645",http://www.grandsgites.com/gite-10-ferme-canal-2509.htm,,,03.25.21.24.33,"Gestion libre : None  Autres infos : Une adhésion annuelle de 20 € est demandée au nom de la personne qui a réservé pour le groupe.  Taxe de séjour : Incluse Location draps : 4,60 €/paire Ménage fin de séjour : 19 €/h Animaux : Admis Chèques vacances : Oui","
Le Gîte Loisirs Méry est une association qui propose la location de la ferme du canal gîte d'étape  en Champagne, dans le village de Méry-sur-Seine, à 30 km de Troyes et 50 km de Provins. Ce gîte est indépendant et ne peut pas être réuni avec l'autre grand gîte de groupe de 60 places qui n'est pas à la même adresse. La ferme du canal est clôturé, vous apprécierez le confort et la propreté. Sur place et sur réservation auprès de l'association, vous pourrez pratiquer: l'équitation dans notre centre équestre situé à 100 mètres et qui est indépendant du gîte, parcourir la vélo-voie qui traverse le village sur votre bicyclette ou faire du Tir à l'arc et enfin profiter des nombreuses visites touristiques à découvrir."
Le Manoir,15,227 km,227168,2 hours 37 mins,9392,2 hours 29 mins,8928,"26 D4, 52220 Montier-en-Der, France","48.4772742,4.7753835",http://www.grandsgites.com/gite-52-le-manoir-315.htm,,,06.84.97.93.31,"Gestion libre : None  Autres infos : Tarifs ci-dessus hors électricité ; Chauffage non inclus  Taxe de séjour : 0,30 € / nuit et personne
 Location draps : 9 € Ménage fin de séjour : 160 € (inclus en semaine juillet/août) Animaux : Non admis Chèques vacances : Non","
Magnifique manoir de la fin XIXème, une maison où il fait bon vivre, à 10 minutes du plus grand lac Artificiel d'Europe, tout près des pistes cyclables, dans un village avec tous commerces et services. Sur place vous visiterez le haras, l'abbatiale. Sur place piscine chauffée."
Ferme de la Renaissance,26,145 km,144555,1 hour 39 mins,5910,1 hour 32 mins,5518,"51 Rue Caroujat Borgniat, 10190 Estissac, France","48.251315, 3.820222",http://www.grandsgites.com/gite-10-ferme-renaissance-2462.htm,,,03.25.40.45.81,Gestion libre : None Demi-pension : Nous consulter  Autres infos : Possibilité de louer la salle de restaurant au rez de chaussée en gestion libre (60 pers.):  Taxe de séjour : Incluse Location draps : Inclus Ménage fin de séjour : 50 € Animaux : Admis Chèques vacances : Non,"
Au cœur du pays d’Othe, à 20 mn de Troyes et 1h30 de Paris, la Ferme de la Renaissance est l’endroit idéal pour se  ressourcer et profiter des activités de plein air (équestres, randonnée pédestre, VTT cyclo). Cette  bâtisse dans le pur style Champenois (briques, craies et poutres en chêne) est l’endroit parfait pour vos week-ends en amoureux, réunions de famille, séminaire, classe verte et centre aéré. Centre équestre et crêperie sur place.
"
La Grange et La Renardière,29,130 km,130094,1 hour 55 mins,6908,1 hour 40 mins,6012,"36 Rue de la Libération, 51270 Champaubert, France","48.879461, 3.776567",http://www.grandsgites.com/gite-51-grange-renardiere-2612.htm,,06.64.26.88.46,03.26.52.74.21,"Gestion libre : Nous consulter  Autres infos : Possibilité de repas traiteur.  Taxe de séjour : None Location draps : Simple 7 € ; Double 10 € Ménage fin de séjour : Inclus Animaux : Admis sous réserve, nous consulter. Chèques vacances : Non","
Située dans la Marne, en Champagne, La Grange et La Renardière, ce sont 2 gîtes mitoyens pour une capacité totale de 29 couchages. Le Grange est aménagée dans une grange entièrement restaurée de l’ancienne ferme familiale. Le lieu est idéal pour les fêtes de famille ou pour les réunions entre amis. Possibilité de louer une salle de 150m² pour 85 personnes assises."
Perle de l'Aube,20,198 km,198249,2 hours 10 mins,7805,2 hours 3 mins,7385,"25 Rue Grande Rue, 10500 Précy-Notre-Dame, France","48.406685, 4.439105",http://www.grandsgites.com/gite-10-perle-aube-3231.htm,,,06.07.58.12.97,Gestion libre : Nous consulter  Autres infos : Nous consulter pour un tarif précis suivant le nombre de personne et la saison.  Taxe de séjour : Non incluse Location draps : 8 € Ménage fin de séjour : 100 € Animaux : Admis Chèques vacances : Non,"
La grande maison de style champenoise en pan de bois et le gite sont situés sur un domaine  de 3 hectares, en bord d'une forêt et d'une  rivière ""l'Aube"" dans le périmètre de la forêt de l'orient, près des lacs. Le domaine met à disposition une salle de réception avec une grande table médiévale pour prendre les repas pouvant accueillir 20 personnes et sa cuisine avec de la place pour danser sur place. Possibilité d'utiliser le barbecue extérieur ou la cheminée intérieur pour griller des cotes de sanglier ou de boeuf. Des traiteurs bio proposent des repas avec les produits de la région à des prix très attractifs. Possibilité de prendre l’apéro sur la terrasse couverte extérieure. Le domaine possède une piscine couverte de 15 x 5 m.
Les  lieux sont  proche  des lacs de la forêt d’orient, à 30 mn de Troyes et 15 mn du parc de Nygloland. A 2 mn vous trouverez une ancienne base militaire transformée pour les sports de delta plane et de  parachutisme et à 12 mns un park accrobranche. Il est également possible de pêcher dans la rivière au bord du domaine ou dans les lacs."
La Ferme des 4 étangs,45,139 km,138701,2 hours 6 mins,7556,1 hour 51 mins,6648,"Unnamed Road, 51270 Montmort-Lucy, France","48.943806, 3.794828",http://www.grandsgites.com/gite-51-ferme-4-etangs-3316.htm,,06.72.97.80.09,03.26.51.43.73,Gestion libre : None  Taxe de séjour : Incluse Location draps : 10 € Ménage fin de séjour : 350 € Animaux : Non admis Chèques vacances : Non,"
Spacieux, pittoresque, confortable, serein voire champêtre, les adjectifs ne manquent pas pour décrire la Ferme des 4 étangs, ancienne étable reconvertie en salle de réception et gîte grande capacité. Sa grande salle permet un aménagement modulable pour les réceptions et les mariages. Grâce à sa terrasse extérieure, ses jardins, vous pourrez accueillir un grand nombre de personnes tout en créant des espaces et des ambiances intimes sur la terrasse. Sa configuration s'adapte parfaitement aux mariages, célébration et toute autre manifestation d'ordre professionnelle ou privée. Dimension salle de 25 m x 8 m,  hauteur de plafond 4 m. Capacité maximale de 130 personnes. Ses 7 chambres à l’étage composées de 45 couchages offrant une grande praticité pour vos convives, employés ou amis. Au RDC: grande salle de 170m² / petite salle de 40m². cuisine aménagée (gestion libre), bar (1 chambre handicapée). A l'étage : 7 chambres (45 couchages) avec lits doubles, lits superposés et lits de 90, salle de bain privative avec WC. Location de draps. Hébergement chevaux.
Location de salle ou du gîte grande Capacité. Pour des évènements professionnels, réunion, séminaire, convention, journée d’étude, 
congrès, représentation de théâtre, formation. Pour des évènements privés
mariage, concert, soirée, réception, cocktail, fête et 
réunion de famille, soirée d’étudiants, anniversaire. Le site est idéal pour l’ornithologie ainsi que pour l'observation des étoiles, aucune lumière de vient concurrencer le ciel"
La Copinière,15,150 km,149619,1 hour 44 mins,6267,1 hour 38 mins,5892,"14 Allée de la Promenade, 10160 Maraye-en-Othe, France","48.1637347,3.8545918",http://www.grandsgites.com/gite-52-la-copiniere-357.htm,,,03.25.74.54.65,"Gestion libre : None  Autres infos : Week-end 2 nuits du vendredi 18h au dimanche  Taxe de séjour : None Location draps : 6,30 €/lit Ménage fin de séjour : 87 € en option Animaux : Non Chèques vacances : Non","
Gîte de groupe pour 15 personnes dans une ancienne fermette champenoise, dans un village au coeur de la forêt d'Othe, à 1h30 de Paris et 25 km de Troyes. Idéal pour les amateurs de séjour au calme, de randonnées en forêt, en famille ou entre amis."
La Renardière,15,130 km,130190,1 hour 56 mins,6941,1 hour 41 mins,6045,"48 Rue des Ormeaux, 51270 Champaubert, France","48.878891, 3.775618",http://www.grandsgites.com/gite-51-la-renardiere-8.htm,,06.64.26.88.46,03.26.52.74.21,Gestion libre : None  Taxe de séjour : None Location draps : 8 € Ménage fin de séjour : Inclus dans le prix Animaux : Oui Chèques vacances : None,"
Gîte aménagé dans une ancienne ferme entièrement rénovée. Idéal pour les fêtes de famille ou pour les réunions entre amis mais aussi pour un séjour au calme. "
Gîte Loisirs Méry,60,147 km,147255,1 hour 56 mins,6964,1 hour 49 mins,6523,"26 Route de Soissons, 10170 Méry-sur-Seine, France","48.510911,3.886536",http://www.grandsgites.com/gite-10-loisirs-mery-2040.htm,,06.83.29.24.83 ,03.25.21.24.33 ,"Gestion libre : None Pension complète : 46,00 €/jour/adulte hors week-end  Autres infos : Une adhésion annuelle de 20 € est demandée au nom de la personne qui a réservé pour le groupe.  Taxe de séjour : Incluse Location draps : 4,60 €/paire Ménage fin de séjour : 19 €/h Animaux : Admis Chèques vacances : Oui","
Le Gîte Loisirs Méry est une association qui propose la location d'un gîte de groupe de 60 places en Champagne, dans le village de Méry-sur-Seine, à 30 km de Troyes et 50 km de Provins. Le gite est un corps de ferme entièrement rénové et clôturé, vous apprécierez le confort et la propreté. Sur place et sur réservation auprès de l'association  vous pourrez pratiquer: l'équitation (dans notre centre équestre), le vélo sur la vélo-voie qui traverse le village, le Tir à l'arc et de nombreuses visites touristiques sont à découvrir."
Gîtes des Ecuries de Chamery,28,163 km,162602,1 hour 54 mins,6812,1 hour 39 mins,5932,"D22, 51500 Chamery, France","49.173666,3.974582",http://www.grandsgites.com/gite-51-ecuries-chamery-1404.htm,,06.87.96.70.69,09.79.06.46.16,"Gestion libre : None  Autres infos : Tarifs gîte 1 chambre: de 300 € le week-end, 350 € le mid-week et 450 € la semaine.  Taxe de séjour : None Location draps : Inclus (lits faits à l'arrivée) Ménage fin de séjour : 25 € Animaux : Non admis Chèques vacances : Oui","
Notre structure se compose de 2 bâtiments séparés au sein d'infrastructures équestres à quelques km de Reims, capitale du champagne. Ils bénéficient tous d'un accès à une piscine intérieure chauffée toute l'année de 9 x 4m. 1er bâtiment à ossature bois: 3 gites de chacun 45 m² pouvant accueillir 4 personnes, composé chacun d'1 chambre avec 2 lits de 1 personne et un clic-clac dans le séjour, salle de bain, cuisine américaine équipée, terrasse individuelle de 20 m², télévision, lave-vaisselle, micro-ondes, wi-fi."
Château de Vaux,23,185 km,185069,1 hour 59 mins,7116,1 hour 52 mins,6714,"Vaux, 10260 Fouchères, France","48.124673, 4.263018",http://www.grandsgites.com/gite-10-chateau-vaux-2861.htm,,,06.33.33.57.94,"Gestion libre : None  Autres infos : Gîtes ouverts toute l'année sans aucun supplément. Tarifs comprenant toutes taxes de séjours, de chauffage, d'eau et d'électricité.  Taxe de séjour : Incluse Location draps : 10 € Ménage fin de séjour : 60 € Animaux : Admis Chèques vacances : Non","
Le gite du Château et le gite de la Ferme sont implantés dans l'enceinte même d'un vaste domaine historique du XVIII ème siècle. Ces deux gites sont disponibles toute l'année pour une location couplée ou séparée en fonction du nombre de convives (de 6 à 23 personnes). Idéalement situés dans un cadre idyllique au milieu d'un incroyable espace naturel préservé, l'accès au Château se fait directement depuis N71 Troyes-Dijon proche du petit village de Fouchères. À 20 mn de Troyes, 15 mn du Lac de la forêt d'Orient, 10 mn du péage A5 et 5 mn du vignoble de la Côte des Bar, ce gîte est l'endroit idéal pour profiter d'un week-end à la campagne tout en profitant de multiples activités (baignade, équitation, golf, tourisme, oenotourisme, chasse)."
Ethic étapes CIS de Champagne,217,158 km,157661,1 hour 53 mins,6770,1 hour 38 mins,5900,"22-26 Chaussée Bocquaine, 51100 Reims, France","49.248967, 4.020922",http://www.grandsgites.com/gite-51-cis-champagne-2987.htm,,,03.26.40.52.60,"Demi-pension : Une nuit 36 € Pension complète : Une nuit 47,20 €  Autres infos : Tarifs groupe différents : sur demande  Taxe de séjour : 0,75 €/nuit/pers. Location draps : Inclus Ménage fin de séjour : Inclus Animaux : Non admis Chèques vacances : Oui","
Le Centre International de Séjour de Champagne se situe dans la ville des Sacres, entouré de verdure et de parcs. Nous accueillons des groupes (sportifs, scolaires...) qui apprécient la capacité d'accueil, la restauration sur place, et les chambres individuelles ou à partager. Mais aussi des individuels qui eux profitent de services comme la cuisine en gestion libre et l'accueil 24h/24, 7j/7."
Villa Lac du Der,15,245 km,245020,2 hours 54 mins,10449,2 hours 46 mins,9985,"6 Rue du Four, 52130 Louvemont, France","48.551724, 4.910145",http://www.grandsgites.com/gite-52-lac-der-2133.htm,,06.84.97.93.31,06.84.97.93.31,"Gestion libre : None  Autres infos : Pour les demandes particulières nous contacter, pour des séminaires si vous avez besoin d'une capacité d'hébergement plus importante, nous avons à 500 m un domaine privé avec locations de  12 chalets  équipés, dans un cadre très agréable, c'est plus exactement le parc d'un ancien château.  Taxe de séjour : 0,30 €/pers./nuit Location draps : 10,50 € (inclus en haute saison) Ménage fin de séjour : 200 € (inclus en haute saison) Animaux : Non admis Chèques vacances : Oui","
Nous sommes heureux de vous présenter notre très belle maison, c'est une demeure hors normes, par sa beauté et par sa grandeur. Elle est offre un confort incontestable, 8 chambres, dont 4 ont des mezzanines avec salons, salles d'eau avec grandes douches et toilettes séparées. Les chambres sont grandes, agencées avec beaucoup de soin, nous avons réalisé ce gîte avec toujours autant de passion, nous aimons accueillir, faire de belles rencontres. La salle à manger très spacieuse est idéale pour des repas en famille, les séminaires, une grande table vous y attend. Il y a une autre grande salle avec deux salons séparés par la cheminée, une salle de billard jouxte le salon. A l'étage une immense mezzanine dessert les autres chambres et les deux autres salles d'eau.  La piscine est chauffée, construite au milieu d'une grande cour entièrement fermée sans vis à vis. Toute la maison a été restaurée que ce soit, l'intérieur comme les extérieurs, tout a été fait avec des matériaux de qualité. Nous chauffons en hiver avec une pompe chaleur eau/eau qui offre un confort inégalable dans un tel volume. Nous sommes situés dans la région du Lac du Der et le lieu est idéal pour la randonnée, les sports nautiques, le patrimoine régionale est riche. Le lac est une formidable réserve ornithologique et vous pourrez admirer les vols de grues cendrées ou des oies rieuses, elles passent chaque jour au dessus de la maison de fin octobre jusqu'à la fin de l'hiver."
Centre hébergement Château de Vaux ,60,185 km,184860,1 hour 58 mins,7074,1 hour 51 mins,6672,"Vaux, 10260 Fouchères, France","48.125688, 4.262994",http://www.grandsgites.com/gite-10-chcvaux-3290.htm,,06.33.33.57.94,09.84.25.93.15,Gestion libre : None  Taxe de séjour : Incluse Location draps : Non inclus Ménage fin de séjour : Non inclus Animaux : Admis Chèques vacances : Non,"
Vaste centre d'hébergement dans le commun Est du château de Vaux - Près de 400 m² avec salon, espaces conviviaux et chambres pour des séjours de 40 à 83 personnes (gites du château et de la ferme compris). Cette partie privative est implantée dans l'enceinte même d'un vaste domaine historique du XVIII ème siècle. Le centre d'hébergement et les 2 gîtes sont disponibles toute l'année pour une location couplée ou séparée en fonction du nombre de convives.
Idéalement situés dans un cadre idyllique au milieu d'un incroyable espace naturel préservé, l'accès au château se fait directement depuis N71 Troyes-Dijon proche du petit village de Fouchères. À 20 mn de Troyes, 15 mn du Lac de la forêt d'Orient, 10 mn du péage A5 et 5 mn du vignoble de la Côte des Bar, ce gîte est l'endroit idéal pour profiter d'un week-end à la campagne tout en profitant de multiples activités (baignade, équitation, golf, tourisme, oenotourisme, chasse).
Le château dispose également de 2 salles de réception, l'Orangerie, de 110 m² et la Grange monumentale de 260 m² pouvant accueillir tout type d'évènements et disponibles à l'année. Plafond à la française, vases en terre cuite italienne et une vue directe sur la cour d'honneur du château donnent à l'ensemble une ambiance raffinée et un prestige incomparable. Plus d'informations sur demande - Visite tous les jours en semaine et le week-end "
Séj. et découvertes en Champagne,31,152 km,151528,2 hours 13 mins,7975,1 hour 58 mins,7073,"1 Allée du Château, 51130 Val-des-Marais, France","48.8186482,3.9641064",http://www.grandsgites.com/gite-51-sejours-champagne-294.htm,,,03.26.59.27.30,"Gestion libre : None Nuit + Petit-déj : 23,50 € (adulte et enfants à partir de 13 ans)  Autres infos : Week-end 2 nuits: du vendredi 18h au dimanche 18h  Taxe de séjour : None Location draps : 6,50 €/pers. Ménage fin de séjour : 160 € ou remise en l'état d'arrivée des lieux Animaux : Oui Chèques vacances : Non","
Gîte de groupe dans une ancienne maison bourgeoise, située dans un parc de 6 Ha au coeur de la Champagne. Lieu idéal pour se retrouver en famille ou entre amis, se détendre et profiter de l'ombre des grands arbres."
Gite du Pont Château de Charbogne,26,220 km,220301,2 hours 37 mins,9440,2 hours 22 mins,8516,"13 Gr Grande Rue, 08130 Charbogne, France","49.501184, 4.587831",http://www.grandsgites.com/gite-08-pont-charbogne-3134.htm,,06.03.47.53.39,03.24.30.18.56,Gestion libre : None  Autres infos : Tarifs adaptés pour les petits groupes jusqu'à 14 personnes  Taxe de séjour : Pas de taxe Location draps : Inclus Ménage fin de séjour : Inclus Animaux : Non admis Chèques vacances : Oui,"
Venez vous ressourcer dans notre château du XVIème siècle. Situé dans le village de Charbogne, petit havre de paix au sud du département des Ardennes.
Notre gîte du pont, très confortable est équipé d'une piscine couverte et chauffée toute l'année. 
12 chambres doubles avec salle d'eau et des toilettes et 1 chambre double (sans sanitaires). Détendez-vous au coin du feu dans la vaste salle à manger... Prenez du temps pour vous ressourcer...
Profitez de moments conviviaux en famille ou entre amis. Le gîte dispose d'une cuisine équipée pour les groupes. Aux beaux jours, profitez de la terrasse surplombant les douves. Possibilité de faire un barbecue. A partager avec l'autre gîte : une table de ping-pong, un portique, un terrain de pétanque.
"
Le Moulin de Moraypré,32,283 km,283451,3 hours 24 mins,12263,3 hours 8 mins,11260,"24 Rue du 24 Août, 08170 Haybes, France","50.011017, 4.723076",http://www.grandsgites.com/gite-08-moulin-moraypre-2337.htm,,,03.24.41.26.78,"Gestion libre : None Nuit + Petit-déj : None Demi-pension : None Pension complète : None  Autres infos : 565 € la première nuit + 355 € la nuit supplémentaire (ménage final inclus)  Taxe de séjour : 0,60 €/nuit/pers. Location draps : 9 € Ménage fin de séjour : Inclus Animaux : Non admis Chèques vacances : Oui","
Dans un ancien moulin à tan, complètement rénové, le Moulin de Moraypré est situé au coeur de la forêt des Ardennes. En bordure de la voie verte trans-Ardennes (piste de cyclable de 83km), sur le Parc de Moraypré (7 hectares), venez profiter en famille ou en groupe d'un cadre qui vous enchantera. Chaque chambre est équipée d'une douche et de 2 lavabos."
La Carandace,20,173 km,173099,2 hours 2 mins,7343,1 hour 47 mins,6434,"2 D966, 51110 Auménancourt, France","49.3800864,4.0380707",http://www.grandsgites.com/gite-51-carandace-837.htm,,06.37.15.58.38,03.26.97.53.69,Gestion libre : None  Autres infos : Week-end du vendredi 16h au dimanche 10h  Taxe de séjour : Incluse Location draps : Inclus Ménage fin de séjour : Inclus Animaux : Non admis Chèques vacances : Non,"
Gite aménagé dans les anciens étable, bergerie et grenier à foin.
Florence et Jérôme vous accueillent, toute l'année, dans une ferme céréalière, cadre clos, fleuri et calme à 10 km au Nord de Reims (D966 Reims-Bruxelles) dans le Pays Rémois aux confluents de 3 départements (Marne-Aisne-Ardennes) et 2 régions (Champagne-Ardenne et Picardie). Les lits sont faits à votre arrivée. A votre écoute pour répondre au mieux à vos besoins ou souhaits pour rendre votre séjour le plus agréable."
Maison des Officiers,20,227 km,226972,2 hours 37 mins,9401,2 hours 29 mins,8937,"4 Place Auguste Lebon, 52220 Montier-en-Der, France","48.478458,4.77056",http://www.grandsgites.com/gite-52-maison-officiers-1417.htm,,07.86.16.95.39,03.25.06.57.70,"Gestion libre : None  Autres infos : Petit déjeuner : 8 €  Taxe de séjour : 0,45 €/pers./nuit Location draps : Inclus Ménage fin de séjour : Inclus Animaux : Non admis Chèques vacances : Oui","
La Maison des Officiers se situe dans le Haras National de Montier en Der, à quelques minutes du Lac du Der. Nous vous proposons également une salle multi-activités avec cuisine pour vos réunions, vin d'honneur, repas de famille, ainsi que la cour d'honneur et son jardin idéal pour vos photos de mariage."
Gites de Villers en Argonne,50,242 km,242218,2 hours 36 mins,9347,2 hours 21 mins,8431,"56-58 Rue du Chemin de Châlons, 51800 Villers-en-Argonne, France","49.019783, 4.938212",http://www.grandsgites.com/gite-51-de-villers-3232.htm,,06.86.97.39.36,03.26.60.37.70,Gestion libre : None Nuit : None Nuit + Petit-déj : None Demi-pension : None Pension complète : None  Autres infos : Le ménage est compris dans tous les tarifs en demi-pension et pension complète.  Taxe de séjour : Incluse Location draps : 8 € Ménage fin de séjour : 200 € Animaux : Non admis Chèques vacances : Oui,"
Gites pouvant accueillir 50 personnes au centre d'un petit village très calme aux portes de la foret d'Argonne (pays des bois). De nombreux chemins de randonnées, sites historiques à visiter, sur place une ferme pédagogique et poney club vous donneront un vrai retour aux sources.
"
Centre Loisirs Vacances Accueil,67,306 km,305779,2 hours 55 mins,10479,2 hours 47 mins,10034,"42 Rue de la Louvière, 52400 Varennes sur Amance, France","47.898722,5.610525",http://www.grandsgites.com/gite-52-loisirs-vacances-accueil-1455.htm,,,03.25.90.61.05,Gestion libre : Nous consulter  Autres infos : Tarifs selon prestation : nous consulter  Taxe de séjour : None Location draps : None Ménage fin de séjour : None Animaux : None Chèques vacances : None,"
Grand gite isolé du village en pleine campagne, à proximité de la forêt, cuisine équipée, espace extérieur avec tables et barbecue. A 300 km Paris Lyon, 90 km de Dijon, 100 km de Nancy, idéal pour réunion de famille. Douche lavabos dans toute les chambres. Gare avec Train direct Paris Lyon à 25 km."
Gite La Pointe,12,149 km,148877,1 hour 42 mins,6135,1 hour 36 mins,5743,"4-8 D23, 10190 Chennegy, France","48.226411, 3.857220",http://www.grandsgites.com/gite-10-la-pointe-3088.htm,,06.78.32.46.13,03.25.75.85.22,Gestion libre : None  Autres infos : Tarif assoupli - pour une occupation jusqu'à 8 personnes avec 4 chambres à disposition au lieu de 5 - réduction de 100 €  Taxe de séjour : Incluse Location draps : Inclus Ménage fin de séjour : 60 € Animaux : Non admis Chèques vacances : Non,"
A 23 km de Troyes, 40 km de Sens, 150 km de Paris – au cœur de la forêt d’Othe ""massif boisé du bassin parisien"" champagne méridionale - autoroute A5. Maison de charme datant de 1799, entièrement restaurée dans son authenticité, indépendante, sur terrain clos arboré et fleuri; idéale pour un séjour familial intergénérationnel ou entre amis. Gîte classé 4 épis ""Gîtes de France"" depuis 2003 - équipé ""bébé câlin"". Compris dans les différents tarifs : draps fournis, lits faits, fournitures des ""indispensables"" pratiques et alimentaires, (check liste à disposition), accès offert au tennis communal, horaires: arrivée/départ flexibles."
Tour de Guet Château de Charbogne,19,220 km,220286,2 hours 37 mins,9432,2 hours 22 mins,8509,"11 Gr Grande Rue, 08130 Charbogne, France","49.501878, 4.588406",http://www.grandsgites.com/gite-08-chateau-charbogne-2229.htm,,06.03.47.53.39,03.24.30.18.56,Gestion libre : None  Autres infos : Tarif disponible pour les petits groupes jusqu'à 11 personnes  Taxe de séjour : Pas de taxe Location draps : Inclus Ménage fin de séjour : Inclus Animaux : Non admis Chèques vacances : Oui,"
Dans la partie rénovée de notre château du 16 ème siècle, notre gîte de grand confort permet d'héberger jusqu'à 19 personnes. Dans la tour, la salle à manger de 70 m² accueillera vos soirées ou  repas en famille, entre amis. Profitez de la cheminée, du baby-foot. La piscine intérieure (chauffée toute l'année) et le sauna agrémenteront votre séjour. Dans le village, vente de produits du terroir et fruits de saison, boulangerie ambulante. A 5 minutes à Attigny : Boulangeries, boucherie, épicerie, supérette, pharmacie, tabac presse, bars. Grandes surfaces à 10 km."
